### ISSUE TITLE
why it takes nearly 40ms to send one tcp package frequently?

### ISSUE THREAD

**Issue by RecharDeng** [kylemanna/docker-openvpn#490]
Hello there, I have one problem during using tcp mode, please help me out.
I deploy my openvpn server in tcp mode through container. It's quite slowly when I tried to visit some applications through vpn networks. So I caught the package stream with tcpdump, which showed that it took nearly 40ms to send one tcp package frequently.
# server config I used
Below content is  the server config file I used:

server 192.168.0.0 255.255.0.0
verb 3
key /etc/openvpn/pki/private/vpn.tbsite.com.key
ca /etc/openvpn/pki/ca.crt
cert /etc/openvpn/pki/issued/vpn.tbsite.com.crt
dh /etc/openvpn/pki/dh.pem
tls-auth /etc/openvpn/pki/ta.key
key-direction 0
keepalive 10 60
persist-key
persist-tun
duplicate-cn 
proto tcp 
port 1194
dev tun0
status /etc/openvpn/openvpn-status.log
user nobody
group nogroup
comp-lzo no
route 192.168.0.0 255.255.0.0
push "comp-lzo no" 
push "route 10.58.0.0 255.255.0.0"
# package stream
These are the packages dumped by tcpdump:

14:32:13.067290 IP 10.58.2.1.59010 > 10.58.2.1.1194: Flags [P.], seq 20104:20210, ack 24715, win 909, length 106
14:32:13.067302 IP 10.58.2.1.1194 > 10.58.2.1.59010: Flags [.], ack 20210, win 383, length 0
14:32:13.070095 IP 10.58.2.1.1194 > 10.58.2.1.59010: Flags [P.], seq 24715:24797, ack 20210, win 383, length 82
14:32:13.092671 IP 10.58.2.1.59010 > 10.58.2.1.1194: Flags [P.], seq 20210:20277, ack 24797, win 909, length 67
14:32:13.131789 IP 10.58.2.1.1194 > 10.58.2.1.59010: Flags [.], ack 20277, win 383, length 0
14:32:13.153433 IP 10.58.2.1.59010 > 10.58.2.1.1194: Flags [P.], seq 20277:20363, ack 24797, win 909, length 86
14:32:13.153442 IP 10.58.2.1.1194 > 10.58.2.1.59010: Flags [.], ack 20363, win 383, length 0
14:32:13.153620 IP 10.58.2.1.1194 > 10.58.2.1.59010: Flags [P.], seq 24797:24876, ack 20363, win 383, length 79
14:32:13.177046 IP 10.58.2.1.59010 > 10.58.2.1.1194: Flags [P.], seq 20363:20430, ack 24876, win 909, length 67
14:32:13.216806 IP 10.58.2.1.1194 > 10.58.2.1.59010: Flags [.], ack 20430, win 383, length 0
14:32:13.238345 IP 10.58.2.1.59010 > 10.58.2.1.1194: Flags [P.], seq 20430:20524, ack 24876, win 909, length 94
14:32:13.238356 IP 10.58.2.1.1194 > 10.58.2.1.59010: Flags [.], ack 20524, win 383, length 0
14:32:13.238613 IP 10.58.2.1.1194 > 10.58.2.1.59010: Flags [P.], seq 24876:24963, ack 20524, win 383, length 87
14:32:13.264722 IP 10.58.2.1.59010 > 10.58.2.1.1194: Flags [P.], seq 20524:20591, ack 24963, win 909, length 67
14:32:13.303781 IP 10.58.2.1.1194 > 10.58.2.1.59010: Flags [.], ack 20591, win 383, length 0
14:32:13.326665 IP 10.58.2.1.59010 > 10.58.2.1.1194: Flags [P.], seq 20591:20693, ack 24963, win 909, length 102
14:32:13.326673 IP 10.58.2.1.1194 > 10.58.2.1.59010: Flags [.], ack 20693, win 383, length 0
14:32:13.326880 IP 10.58.2.1.1194 > 10.58.2.1.59010: Flags [P.], seq 24963:25045, ack 20693, win 383, length 82
14:32:13.352098 IP 10.58.2.1.59010 > 10.58.2.1.1194: Flags [P.], seq 20693:20760, ack 25045, win 909, length 67
14:32:13.391804 IP 10.58.2.1.1194 > 10.58.2.1.59010: Flags [.], ack 20760, win 383, length 0
14:32:13.412898 IP 10.58.2.1.59010 > 10.58.2.1.1194: Flags [P.], seq 20760:20846, ack 25045, win 909, length 86
14:32:13.412906 IP 10.58.2.1.1194 > 10.58.2.1.59010: Flags [.], ack 20846, win 383, length 0
14:32:13.413088 IP 10.58.2.1.1194 > 10.58.2.1.59010: Flags [P.], seq 25045:25124, ack 20846, win 383, length 79
14:32:13.434882 IP 10.58.2.1.59010 > 10.58.2.1.1194: Flags [P.], seq 20846:20913, ack 25124, win 909, length 67
14:32:13.474786 IP 10.58.2.1.1194 > 10.58.2.1.59010: Flags [.], ack 20913, win 383, length 0
14:32:13.496416 IP 10.58.2.1.59010 > 10.58.2.1.1194: Flags [P.], seq 20913:21017, ack 25124, win 909, length 104
14:32:13.496425 IP 10.58.2.1.1194 > 10.58.2.1.59010: Flags [.], ack 21017, win 383, length 0
14:32:13.496608 IP 10.58.2.1.1194 > 10.58.2.1.59010: Flags [P.], seq 25124:25206, ack 21017, win 383, length 82
14:32:13.520246 IP 10.58.2.1.59010 > 10.58.2.1.1194: Flags [P.], seq 21017:21084, ack 25206, win 909, length 67
14:32:13.559782 IP 10.58.2.1.1194 > 10.58.2.1.59010: Flags [.], ack 21084, win 383, length 0
14:32:13.581356 IP 10.58.2.1.59010 > 10.58.2.1.1194: Flags [P.], seq 21084:21170, ack 25206, win 909, length 86
14:32:13.581852 IP 10.58.2.1.1194 > 10.58.2.1.59010: Flags [.], ack 21170, win 383, length 0
14:32:13.582009 IP 10.58.2.1.1194 > 10.58.2.1.59010: Flags [P.], seq 25206:25285, ack 21170, win 383, length 79
14:32:13.603416 IP 10.58.2.1.59010 > 10.58.2.1.1194: Flags [P.], seq 21170:21237, ack 25285, win 909, length 67
14:32:13.642780 IP 10.58.2.1.1194 > 10.58.2.1.59010: Flags [.], ack 21237, win 383, length 0
14:32:13.664625 IP 10.58.2.1.59010 > 10.58.2.1.1194: Flags [P.], seq 21237:21330, ack 25285, win 909, length 93
14:32:13.664683 IP 10.58.2.1.1194 > 10.58.2.1.59010: Flags [.], ack 21330, win 383, length 0
14:32:13.664850 IP 10.58.2.1.1194 > 10.58.2.1.59010: Flags [P.], seq 25285:25367, ack 21330, win 383, length 82
14:32:13.686904 IP 10.58.2.1.59010 > 10.58.2.1.1194: Flags [P.], seq 21330:21397, ack 25367, win 909, length 67
14:32:13.726786 IP 10.58.2.1.1194 > 10.58.2.1.59010: Flags [.], ack 21397, win 383, length 0
14:32:13.748461 IP 10.58.2.1.59010 > 10.58.2.1.1194: Flags [P.], seq 21397:21480, ack 25367, win 909, length 83
14:32:13.748504 IP 10.58.2.1.1194 > 10.58.2.1.59010: Flags [.], ack 21480, win 383, length 0
14:32:13.748681 IP 10.58.2.1.1194 > 10.58.2.1.59010: Flags [P.], seq 25367:25445, ack 21480, win 383, length 78
14:32:13.771942 IP 10.58.2.1.59010 > 10.58.2.1.1194: Flags [P.], seq 21480:21547, ack 25445, win 909, length 67
14:32:13.811785 IP 10.58.2.1.1194 > 10.58.2.1.59010: Flags [.], ack 21547, win 383, length 0

Could you please tell me what's going wrong? 
Thank you very much.

**Comment by RecharDeng** [comment]
The root cause is that tcp protocol was used here. Switch to udp, problem solved. You can find the detail in http://sites.inka.de/sites/bigred/devel/tcp-tcp.html
